<?xml version="1.0" encoding="UTF-8"?>
<!--Sample XML file generated by XMLSpy v2010 (http://www.altova.com)-->
<VolunteerMonitoringReport xsi:schemaLocation="http://aphis.usda.gov/epermits/XML_SCHEMA/VolunteerMonitoringReport ..\schemas\VolunteerMonitoringReport.xsd" xmlns="http://aphis.usda.gov/epermits/XML_SCHEMA/VolunteerMonitoringReport" xmlns:xsi="http://www.w3.org/2001/XMLSchema-instance">
    <ApplicationId>10-347-101r</ApplicationId>
    <Location>  
        <LocationUniqueId>[Location1]</LocationUniqueId>
         <MonitoringPeriod>
            <Start>2010-12-04</Start>
            <End>2010-12-05</End>
            <ObservationDetails>
                <ObservationDetail>
                    <Date>2010-12-04</Date>
                    <Volunteers>15</Volunteers>
                    <VolunteerUnit>per acre</VolunteerUnit>
                    <ActionsTaken>123456789 </ActionsTaken>
                    <Comments>test</Comments>
                </ObservationDetail>
             </ObservationDetails>
            <Comments>a</Comments>
        </MonitoringPeriod>
        <NoMonitoring>
			<Date>2010-12-04</Date>
			<Comment>testing</Comment>
        </NoMonitoring>
    </Location>    
</VolunteerMonitoringReport>
